commentId,creationTime,nickname,referenceName,userLevelId,isPlus,score,content
103541140161515728,2026-01-14 16:21:45,兔斯基只会茫然,"[{""颜色"": ""雪山白 ""}]",,否,1,耳机很好用，音质清晰，连接稳定，用起来非常方便，降噪效果明显，还有很多模式自去调，小巧挂耳也不会掉，只要没有那种软硅胶塞耳的我很喜欢，体验感还不错
103572610164202156,2025-12-31 18:29:33,3***u,"[{""颜色"": ""雪山白 ""}]",,否,1,在京东买的小米蓝牙耳机到手啦😍!音质超棒，听歌、通话都超清晰。佩戴也舒适，久戴不痛。续航给力，充电一次能用好久。必须给个五星好评👍!
103564780155733649,2025-12-26 06:38:08,j***1,"[{""颜色"": ""雪山白 ""}]",,否,1,挑选了很久，买了小米的这款蓝牙耳机，做工很精细，质感高级，试用后感觉音质还是挺不错的，续航能力也还挺好的。佩戴久了耳朵也不会难受？
24941271999,2025-11-07 10:29:32,3***n,"[{""颜色"": ""钛光金 ""}]",,否,1,外观漂亮大方，做工精细，耳机音质很好。美中不足是耳机续航时间较短，在听音乐的情况下两小时电量从100%降到30%，放回充电盒中充电30分钟充到100%，充电盒电量从100%降到84%左右。
103700070164097427,2026-01-08 07:40:45,j***2,"[{""颜色"": ""雪山白 ""}]",,否,1,给家人买的小礼物，价格实惠，产品设计的还不错，功能比较齐备，在这个价格还算不错了，当然还可以做的更好一些，还有很大的提升空间
102670470145152113,2025-11-24 22:07:14,快***买,"[{""颜色"": ""雪山白 ""}]",,否,1,外观不错白色的好看 音质也挺好的， 就是价格买的早了点略贵 现在小米除了便宜货 稍微上点档次的已经没啥性价比了 快递给力速度很快
103393330153018500,2026-01-05 11:47:22,面***娇,"[{""颜色"": ""钛光金 ""}]",,否,1,质量很好，续航时间长，银色超级好看，推荐，音效环绕超级舒适，价格也很优惠，不错不错推荐推荐，做工细致精致大方大气不失时尚
25015470505,2025-11-15 21:01:09,衡州府文文,"[{""颜色"": ""月影黑 ""}]",,否,1,小米的耳机不是第一次买了，就是看中它的性价比，主要是音质音效很好，做工质感也好，续航能力强，无损音乐，听着太舒服了。给力。
103822090168349126,2026-01-19 23:01:47,涛声依旧王涛,"[{""颜色"": ""雪山白 ""}]",,否,1,年终给北京分公司的同事安排礼品奖励，在京东商城闲逛，发现这款小米蓝牙耳机非常漂亮，销量也很火爆，听说是雷军同款，可以很好的适配苹果和安卓手机。
103185090148430320,2025-11-16 11:16:27,j***N,"[{""颜色"": ""冰霜蓝 ""}]",,否,1,第二次购买了。是收到第一款的第二天， 送给侄子的礼物🎁。他很喜欢。 他说音质不错，连接手机顺畅，不容易掉。已经丝滑切换到安卓阵营。
23770317971,2025-06-14 21:03:55,1***r,"[{""颜色"": ""冰霜蓝 ""}]",,否,1,买了冰霜蓝，颜色好看不落凡俗。半入耳式佩戴舒适，自带降噪功能。音质好。和手机连接响应速度快。有国补，价格好。充电速度也杠杠的。值得购买！
23820714546,2025-06-20 15:47:36,y***5,"[{""颜色"": ""钛光金 ""}]",,否,1,续航能力：开降噪3h出头。 舒适度：很好，几乎无感佩戴。 音质音效：开降噪后音质依旧不错，解析力可以，到手固件比较老，更新后音质有较大提升。另外需要手动将系统设置中的音效切换至原声。澎湃系统bug之处在于每次耳机连接都默认切换到小米音效，耳机声音闷、糊、低沉，澎湃系统扣大分。 做工质感：颜色很高级。
24130801557,2025-08-02 14:35:37,N***U,"[{""颜色"": ""雪山白 ""}]",,否,1,耳机小巧，造型很好看，降噪效果很不错，能够过滤掉一些环境声，不管是听歌还是外出出差，携带也方便，就是触摸操作需要用力按，操作失败率比较高
23571747149,2025-05-23 01:45:16,是***卜,"[{""颜色"": ""钛光金 ""}]",,否,1,一直是小米的粉丝儿，这次买了这个耳机换下了用了三年的3Pro，5代开放入耳，不压耳，不硌耳，但佩戴起来又很紧实，运动，骑车都不会掉，音质来讲，低音明显，高音洪亮，日唱使用绝佳选择
24264980904,2025-08-20 09:28:47,SenlerWang,"[{""颜色"": ""冰霜蓝 ""}]",,否,1,等了很久终于乘国补的机会拿下，当时在小米之家试听了一下，音质远高于预期，不过价格有点超预期。 做工质感：正常水平，也挑不出什么毛病。 音质音效：最满意的就是音质，低音刚刚好，三频不像其他耳机的黏在一起，不管是听音乐还是听小说，都很棒。 舒适度：戴久了不疼。 续航能力：中规中矩，不短也不长。
23622664935,2025-05-27 20:03:45,繁***w,"[{""颜色"": ""冰霜蓝 ""}]",,否,1,用的小米手机，自然搭配小米耳机效果更加，个人不习惯佩戴入耳式耳机，这款buds 5正好符合我的要求，蓝色的是磨砂外观，音质不错，延迟低，叠加国补价格优！
23598533554,2025-05-25 14:57:43,D***子,"[{""颜色"": ""钛光金 ""}]",,否,1,"耳机用起来确实不错，我是小米手机，打开就直接连上了，有降噪的功能，但是没那么明显。电量目前还比较耐用，后续再看看，我戴着跑步也没有掉，入耳也ok,不是那种浅浅的"
24444544017,2025-09-11 00:35:57,j***3,"[{""颜色"": ""雪山白 ""}]",,否,1,这款耳机太好看了，简直是物美价廉。音质也不错。买这个小包包配上很好看。降噪效果也还可以，续航能力很棒。最主要的是这个质感特别棒。磁吸的！
23663817640,2025-06-01 12:44:39,q***_,"[{""颜色"": ""钛光金 ""}]",,否,1,续航还可以，外观非常喜欢，音质方面的话也是比较突出的，佩戴没有入耳式耳机那种涨耳朵的感觉。耳朵佩戴的感觉很不错。 音质音效：音质确实挺不错的，高音，低音都还可以。
23604824422,2025-05-26 06:24:04,栗***丶,"[{""颜色"": ""月影黑 ""}]",,否,1,小米的耳机第一次买，感觉还行。四五百块的还有降噪。没的说。 做工质感：还可以 音质音效：也还行 舒适度：比入耳的好 续航能力：挺强
23787561841,2025-06-16 21:46:51,C***s,"[{""颜色"": ""钛光金 ""}]",,否,1,本人使用是米系设备（小米14pr、平板7pad pro），和电脑（已安装小米电脑管家）联动起来很不错，对比我以前用的耳机（redmi buds 5）来说音质有了很大的进步，降噪也没太严重的耳压感，使用起来还不错
23803649743,2025-06-18 14:21:34,y***4,"[{""颜色"": ""冰霜蓝 ""}]",,否,1,非常有质感，本人耳朵有点小，带平常的那种总感觉会掉，这个就不会，而且当耳机拿掉的时候视频或者歌曲会暂停，非常喜欢，很舒适。
24232797200,2025-08-16 07:47:23,不***一,"[{""颜色"": ""钛光金 ""}]",,否,1,物超所值！佩戴舒适稳固，音质清晰均衡，日常听歌通话够用。蓝牙连接快且稳定，续航持久，充电方便。作为入门或通勤运动耳机，性价比很高，值得入手！
23630166757,2025-05-28 16:45:05,俊***2,"[{""颜色"": ""月影黑 ""}]",,否,1,做工质感：外观不错 音质音效：音效很好，没有任何卡顿 舒适度：佩戴舒适，长时间都不会耳朵疼 续航能力：续航正常
24793226023,2025-10-22 08:35:09,小玥玥de麻麻,"[{""颜色"": ""钛光金 ""}]",,否,1,给老公买的，他很喜欢，新换的手机小米17Pro，配件也必须得跟上，京东速度很快，中午买晚上就到，降噪效果很棒，音质也很好、果然贵有贵的道理可言。
23423479569,2025-05-14 18:35:48,眭***越,"[{""颜色"": ""月影黑 ""}]",,否,1,买的是黑色的小米耳机，做工精细，外壳是磨砂质感和黑亮质感的结合，很喜欢，耳机轻巧，试听，音质通透，听音乐很享受，不过是入耳式，长时间听不知道会不会耳朵不舒服。
23720496895,2025-06-08 12:12:35,j***r,"[{""颜色"": ""钛光金 ""}]",,否,1,做工质感：银色高级感 音质音效：哈曼调音，沉浸感十足 舒适度：待久不疼，买过最好耳机了 其他特色：喜欢可冲！
24163926167,2025-08-06 20:10:47,t***g,"[{""颜色"": ""月影黑 ""}]",,否,1,耳机可以的，跟小米手机链连接很方便，音质也很OK，带起来也很有型，做工质量也很优，再加上是我喜欢的颜色，真是爱不释手，一如既往支持小米。
24569619419,2025-09-22 23:08:56,齐鲁莽夫,"[{""颜色"": ""月影黑 ""}]",,否,1,非常满意的一次购物，和我的小米14手机丝滑连接，不需要做任何设置，音质也不错，待机时间足够长，戴在耳朵上几乎无感觉，很好。
24794741477,2025-10-22 11:21:23,不要乱拔草,"[{""颜色"": ""月影黑 ""}]",,否,1,以前用小米buds3pro，用了三年，一直都很好用，最近不能充电了，选了很多款耳机，最后还是买了小米Buds5，可能是习惯了，音质可以，对于听听歌，看看视频的我够用了。
23690729406,2025-06-04 18:46:39,吾***蝣,"[{""颜色"": ""月影黑 ""}]",,否,1,做工质感很好，黑色看起来是亮银色，音质还不错，操作简单方便，佩戴舒适续航实测3小时左右，还可以，主要还有录音功能很不错！
24259674629,2025-08-19 18:11:27,mashenggui,"[{""颜色"": ""雪山白 ""}]",,否,1,十分精美，包装简洁，物流发货相当快，政府补贴也相当给力，测试了下，音质不错，降噪效果达到预算，性价比不愧为小米的拳头产品，体验感相当好的购物体验
23728524657,2025-06-09 12:59:07,s***e,"[{""颜色"": ""钛光金 ""}]",,否,1,第一次买小米的这款Buds5无线蓝牙耳机，价格上算是中端的一款耳机了，拆开包装感觉还是很不错的，肉眼可见的做工非常精细，这个耳机配色设计简约有科技感，触感非常的细腻，总之没有让我失望。
23673680322,2025-06-02 18:04:22,搞***么,"[{""颜色"": ""月影黑 ""}]",,否,1,音质音效：音质非常的可以 舒适度：舒适度可以 可以长时间佩戴 做工质感：做工非常好 很圆润 续航能力：续航时间很长
24918758176,2025-11-05 00:23:32,这根烟灭我要走,"[{""颜色"": ""钛光金 ""}]",,否,1,性价比超高👍价格亲民，音质出色，低频浑厚、高频通透，细节还原度好。佩戴舒适，还支持多种音效模式，降噪功能也很实用，爱了!
23763865564,2025-06-13 21:43:30,j***k,"[{""颜色"": ""钛光金 ""}]",,否,1,音质清晰低音饱满，蓝牙连接稳定无延迟，佩戴舒适久戴不累，续航给力能用一整天，性价比超高！京东物流速度一如既往的快，包装完好无破损，还会回购！
23944942857,2025-07-08 16:07:27,事***顺,"[{""颜色"": ""月影黑 ""}]",,否,1,收到了耳机了，感谢快递员大雨帮我送到家里，打开快点看看耳机，非常喜欢，手感很好，拆开后链接了手机试了一下，听起来飘飘欲仙，音质非常好。
23869192051,2025-06-27 10:39:52,Q***5,"[{""颜色"": ""钛光金 ""}]",,否,1,做工质感：相当不错，感觉 音质音效：感觉可以 舒适度：戴起来比较舒服，但是也怕它容易掉 续航能力：续航能力超强可以 其他特色：是比较小巧且很便携，但是比较小，也是比较容易丢失的，也是怕容易掉丢失的，价格相对昂贵一点。
24897398922,2025-11-02 19:18:53,热心市民高le高,"[{""颜色"": ""钛光金 ""}]",,否,1,小米的耳机这是我买的第二个耳机了，跟第一个耳机相比的话这个耳机不用入耳特别深，所以戴的时间久了耳朵也没有闷的感觉，嗯降噪功能也是不错的，坐地铁使用感也很好
23592035160,2025-05-24 20:36:24,大***扬,"[{""颜色"": ""钛光金 ""}]",,否,1,这个耳机颜值很高，颜色很高级，很有质感，音质非常好，性价比很高，适配度很好，充一次电能用非常久，推荐大家购买，一定不会失望的啦
23580508007,2025-05-23 19:45:56,疯***调,"[{""颜色"": ""钛光金 ""}]",,否,1,这款耳机真的很不错，用着很顺手，声音也很清晰，值得推荐。 续航能力：中规中矩 音质音效：很棒 舒适度：中规中矩 做工质感：很棒
23742513301,2025-06-11 08:20:56,苦***噢,"[{""颜色"": ""钛光金 ""}]",,否,1,因为小米手机买了小米的耳机，音乐声音效果都很好，续航也不错，入耳也挺舒服，就是好像有个小bug，有时候刚连接上了蓝牙，却没有声音，要等一会才会有。
23738862979,2025-06-10 17:02:30,l***3,"[{""颜色"": ""月影黑 ""}]",,否,1,外观小巧，做工精致，音色特别好，充电也快，一直用小米的耳塞，中间换了一个品牌，感觉没有小米好用，果断换回来，物有所值！
23806796966,2025-06-18 21:09:08,锤***社,"[{""颜色"": ""雪山白 ""}]",,否,1,这个耳机匹配小米手机音质无敌了，不愧是米家自家产品开盖即链接，我以前使用漫步者的感觉匹配性很差要开关蓝牙几次才能链接，小米耳机秒连，颜值好看又轻巧待机时间长音质无敌，值得购买
23601359762,2025-05-25 19:42:55,T***u,"[{""颜色"": ""钛光金 ""}]",,否,1,音质真的惊艳到我了!高音清晰明亮，低音浑厚有力，听起歌来仿佛置身于演唱会现场，细节都能听得清清楚楚。而且它的降噪功能超厉害，开启之后周围的嘈杂声瞬间被隔绝，让我能全身心沉浸在音乐世界里。
23682436409,2025-06-03 19:06:41,I***属,"[{""颜色"": ""钛光金 ""}]",,否,1,颜值担当，做工精细，连接方便，音质一流，佩戴舒适。试听试戴后，感觉降噪效果不错，待机时间尚可，耳机充电挺快。
24216662840,2025-08-13 23:35:19,Y***彬,"[{""颜色"": ""雪山白 ""}]",,否,1,感觉还可以，在有噪音环境情况下听音乐音质都还是很棒 ，耳机而且不需要很塞入耳 在听音乐的情况别人打招呼也能听见外声。
24844128531,2025-10-27 20:37:12,沐***4,"[{""颜色"": ""钛光金 ""}]",,否,1,耳机音质棒棒的，佩戴也很舒适，之前有个白色的十一出去玩在南昌丢酒店里了，性价比很高，虽然宝贝不一定是最好的，但在同等的价位里面绝对是表现最棒的。
24361996300,2025-08-31 11:08:37,硬***4,"[{""颜色"": ""月影黑 ""}]",,否,1,品质很好，性价比高。本来也打算考虑buds5Pro，但是耳朵戴不惯入耳式，而且毕竟贵400块钱，也就没再考虑。音质不错，希望经久耐用。
23589302390,2025-05-24 15:02:05,迷***航,"[{""颜色"": ""雪山白 ""}]",,否,1,小米这个耳机真是在细节上人性化了，取耳机和放耳机都很方便，不像某些插入式充电的很难取出来耳机，音质没的说，高低音都很清晰，很完美
23715889573,2025-06-07 19:52:51,山***花,"[{""颜色"": ""月影黑 ""}]",,否,1,非常喜欢，简直是我的心头宠，买来之后一个周天天听，一直没有充电，续航很强，拿取也很方便，颜值也很高，简直太喜欢了！
24291233768,2025-08-22 21:32:10,j***i,"[{""颜色"": ""冰霜蓝 ""}]",,否,1,新耳机到了，音质超好，听的很舒服，而且很多功能都可以让我不用打开手机直接在耳机上轻碰操控就真的很方便，而且戴上去也不像以前那种耳机有挤耳朵的感觉，就很轻盈。
23826005995,2025-06-21 11:16:09,时***1,"[{""颜色"": ""钛光金 ""}]",,否,1,这款耳机看了很久，618果断拿下，商品质量一流棒，长佩戴佩戴也不会觉得耳朵疼，好产品、好品质、好服务，宝贝确实值这个价钱，颜值也很棒
23598938268,2025-05-25 15:52:14,Z***8,"[{""颜色"": ""钛光金 ""}]",,否,1,很不错，线下试了音质觉得比较不错，然后京东可以参加国补，就立马下单了，果然没让我失望，自己配了耳机壳，超级乖乖.
24887683728,2025-11-01 17:53:12,大***瓜,"[{""颜色"": ""雪山白 ""}]",,否,1,很好很强大，很好很强大。很好很强大。 音质非常棒。跟小米手机连接非常方便。 多设备协同，非常好用。米粉必备。比红米的音质好一点点。
24854250455,2025-10-28 23:54:44,q***z,"[{""颜色"": ""月影黑 ""}]",,否,1,很好用，很好用，信任小米，小米的耳机非常好，家里有很多小米的东西，做工好音质，质感好舒适好，续航能力强，下次再买，再接着用
23719728022,2025-06-08 10:46:17,j***6,"[{""颜色"": ""钛光金 ""}]",,否,1,音效只能说就那样，就是这个降噪感觉还没我这个3代方便好用（这个是主动降噪）可能是没习惯，银色这个整体挺好看的，戴在耳朵上没有不舒服，戴久了我耳朵也不痛，整体来说600这个阶位中规中矩的。我这个3代用了好几年没修过，现在都能听，只不过左耳听着听着没电了，续航还差半小时基本就无了，所以小米这品牌还是可以的。
23789788806,2025-06-17 07:27:40,孙***凯,"[{""颜色"": ""钛光金 ""}]",,否,1,小米Buds5蓝牙耳机真不错。音质清晰饱满，降噪也好，通话也很清晰。半入耳设计很舒服，戴一整天耳朵都不会疼。充电盒小巧便携，续航给力，入手不亏！
23668105357,2025-06-02 01:00:46,枫***世,"[{""颜色"": ""雪山白 ""}]",,否,1,昨天下的单今天就到了，京东的物流很给力。到手试听了一下，耳机的音质非常棒，沉浸式的体验，谁用谁知道。
23788089209,2025-06-16 22:40:14,风***r,"[{""颜色"": ""月影黑 ""}]",,否,1,半入耳式的降噪耳机，搭配小米15手机，同品牌适配性更好。相比入耳式耳机，半入耳式佩戴更舒适，户外运动也可以佩戴，不会掉落。 缺点是降噪能力会相对弱一些，光面设计更容易磨损划痕，如果是全磨砂质感更好也更实用。 国补+618，价格实惠。
24813088631,2025-10-24 11:36:26,q***5,"[{""颜色"": ""雪山白 ""}]",,否,1,小米的产品值得信赖，主要是它的颜色性价比都非常高。看了一圈还是订了这一款的，使用下来非常棒，大品牌值得推荐，小米的设计感和音质也非常好
23422798960,2025-05-14 17:59:03,小***淋,"[{""颜色"": ""雪山白 ""}]",,否,1,很好看呀也很好用，之前用的苹果这次换了小米，便宜了一半价格但用起来一样的好用，很喜欢还给身边的朋友都推荐了，音质音效都很棒
24234374592,2025-08-16 13:19:24,keresen,"[{""颜色"": ""雪山白 ""}]",,否,1,小米的手机肯定适配小米耳机，做工非常精良，入耳感觉很棒，连接迅速，音质很好，很让人惊喜，强烈推荐，京东送货速度那是没的说
24049900068,2025-07-22 23:09:56,j***y,"[{""颜色"": ""雪山白 ""}]",,否,1,1做工质感：做工很精细，手感也不错，下面光面，上面磨砂的。 2音质音效：音质音效也不错，主动降噪很给力，也可以关闭此功能。 3舒适度：佩戴很舒适，时间长了也不会有涨痛的感觉。 1续航能力：续航能力还可以吧，充电仓可以充好几次。 1其他特色：和小米手机可以自动适配连接，用起来很方便。
24844310373,2025-10-27 20:54:35,j***i,"[{""颜色"": ""雪山白 ""}]",,否,1,大品牌质量值得信赖，音质很好，款式设计新颖，美观大方，半入耳式，佩戴舒服，电池续航能力不错，价格实惠，包装结实完好无损，推荐品牌。
23660352112,2025-05-31 22:48:02,h***u,"[{""颜色"": ""钛光金 ""}]",,否,1,Xiaomi Buds 5 外观颜值高，手感佳，拿起来很小巧，，戴上不会感到累赘，相对上一代buds 4，音质提升明显，续航增强，搭配小米系列手机，简直绝配，值得推荐。
24291155726,2025-08-22 21:18:32,j***5,"[{""颜色"": ""月影黑 ""}]",,否,1,耳机这东西，够用就行。我耳朵出油比较多之前用的是苹果耳机，这款耳机没有胶套，用起来会好很多，音质和苹果的差的有点多，但平时也够用。
23760755549,2025-06-13 15:07:28,马***啊,"[{""颜色"": ""钛光金 ""}]",,否,1,家里人过生日买来当礼物的，趁着 国补价格特别合适。京东快递也能次日达，一直在用小米的耳机，长辈对买的这个也很满意
23274308904,2025-05-06 11:32:31,孙***号,"[{""颜色"": ""钛光金 ""}]",,否,1,隔音降噪效果不错哦，性价比超级高，才几百块，比某果性价比比高啊！颜色也好看，还能照镜子，就是电流感有点强，带上耳机附近的声音很清楚很近的感觉
23679687753,2025-06-03 13:26:11,j***k,"[{""颜色"": ""月影黑 ""}]",,否,1,反复试了好久，最后还是决定买这款耳机，性价比是真的高，网上都说freebuds5音质比它能好一些，但是我反复听反复试就是感觉它的音质好一些，也不是说freebuds5不好，就是相比之下还是觉得这款耳机值得入手，我上款耳机也用的是华为的，也用了好几年这才准备换的耳机，希望我们国产大品牌越做越好，让我们值得信赖！
24582242880,2025-09-24 10:36:00,-***-,"[{""颜色"": ""钛光金 ""}]",,否,1,做工质感：质感很不错，摸起来很舒服， 音质音效：音质很好，听起来很舒服， 续航能力：续航能力还没试，拿到70的电，看看能用多久， 舒适度：带着很舒服，没啥其他感觉，
23727239110,2025-06-09 10:52:00,j***6,"[{""颜色"": ""冰霜蓝 ""}]",,否,1,用了一段时间过来评价，音质超乎意料，并且质感很好耳机盒的材质拼接我很喜欢蓝牙链接也很稳定，唯一后悔没有买Pro版
24192675589,2025-08-11 12:00:01,张哿玮,"[{""颜色"": ""雪山白 ""}]",,否,1,小米Buds 5作为半入耳式蓝牙耳机，在舒适度和音质表现上认可。其轻量化设计（单耳仅4.5克）和符合人体工学的倾斜导管，使长时间佩戴几乎无压迫感，适合通勤或办公场景。音质方面，12.4mm动圈单元带来出色的低频表现，下潜深沉有弹性，尤其适合流行乐与电子乐。
23636715364,2025-05-29 10:47:15,j***o,"[{""颜色"": ""冰霜蓝 ""}]",,否,1,做工质感：做工质感还是可以的，符合这个价位。 音质音效：音质很不错，经久耐听的音质，而且包围感很强。 舒适度：佩戴舒适度非常舒适。
24513476009,2025-09-16 19:48:52,殿小生a,"[{""颜色"": ""钛光金 ""}]",,否,1,耳机好评这耳机真是太棒了，音质清晰、舒适度满分！ 音质清晰得像在现场一样，舒适度也是满分中的满分。戴着它听音乐简直是一种享受啊
24184254976,2025-08-09 19:50:58,徐***1,"[{""颜色"": ""月影黑 ""}]",,否,1,纠结了很久最后还是选择了这款耳机，看起来很有质用后 感，在地铁打开降噪模式再也不吵了，直接在地铁上睡 一路，非常的舒服，戴起来耳朵也不疼，续航也很久
23643941717,2025-05-30 00:33:57,a***m,"[{""颜色"": ""月影黑 ""}]",,否,1,小米耳机以其出色的性价比和优良的音质表现，在市场上赢得众多消费者的青睐。其设计简洁时尚，佩戴舒服，适合长时间使用。耳机连接稳定，操作简便，配合小米手机使用感极佳。
23804331224,2025-06-18 15:52:15,r***b,"[{""颜色"": ""钛光金 ""}]",,否,1,做工质感：非常好 音质音效：优秀 舒适度：舒服 续航能力：和描述一样 其他特色：外观精美漂亮，体验非常完美，科技感十足，不同其他品牌，完美的一次购物。这个颜色好看非常喜欢。
23662301852,2025-06-01 09:23:54,1***姐,"[{""颜色"": ""雪山白 ""}]",,否,1,超好用的一个耳机，可能以前买的都不那么耐用，这个我用了半个月都不用充电。真的很不错 强烈推荐。 做工质感：不错 音质音效：挺好 舒适度：我觉得可以 续航能力：不要太好
23980536693,2025-07-13 18:05:39,小***1,"[{""颜色"": ""雪山白 ""}]",,否,1,对比了airpods和这个，最终选择了小米，毕竟用的小米手机，方便连接，性价比高，音质不错，降噪效果好
24070730667,2025-07-25 14:47:34,j***r,"[{""颜色"": ""钛光金 ""}]",,否,1,还行吧，造型不错，音质也还不错👍性价比可以，带着也挺舒服，使用方便，续航时间还行，降噪效果一般&hellip;&hellip;
23497064733,2025-05-18 18:59:16,j***i,"[{""颜色"": ""雪山白 ""}]",,否,1,舒适度：我耳朵小戴很多都会有点不舒服但是这个没有戴久了耳朵也不痛 音质音效：音质真的没话说，特别喜欢！ 做工质感：拿到手手感真的一绝，特别惊喜
24453182595,2025-09-12 06:34:01,躺***6,"[{""颜色"": ""钛光金 ""}]",,否,1,外观质量都还不错，挺好看的 音质音效：很好 舒适度：很好 做工质感：非常好 续航能力：有待考究，搭配充电仓，也还可以接受
23690901527,2025-06-04 19:02:02,j***d,"[{""颜色"": ""月影黑 ""}]",,否,1,&zwnj;耳机音质清晰，佩戴舒适，外观设计简洁大方，蓝牙连接稳定，兼具高性价比与实用功能，综合体验优秀&zwnj;。
23617590943,2025-05-27 11:40:14,一***咎,"[{""颜色"": ""钛光金 ""}]",,否,1,包装质感很好，耳机小巧重量轻，音质还不错，人声比较清晰，开盖弹出动画迅速，总体还算满意。
23678396586,2025-06-03 11:00:28,井***版,"[{""颜色"": ""钛光金 ""}]",,否,1,降噪聊胜于无，室内办公室比较合适 外观好看，佩戴舒适 音质比较好 和小米手机适配非常好 续航正常，不短
